{
  "target_id": "tgt_engyltusfm20260611",
  "source_id": "src_engyltpublic",
  "requested_url": "https://ebible.org/Scriptures/engylt_usfm.zip",
  "details_url": "https://ebible.org/bible/details.php?all=1&id=engylt",
  "expected_media_type": "application/zip",
  "expected_bytes": 1385550,
  "upstream_last_modified": "2026-06-11T13:23:20Z",
  "upstream_edition": "Young's Literal Translation, public-domain eBible.org edition",
  "source_files_date": "2025-12-12",
  "expected_sha256": null,
  "verification_status": "registered",
  "archive_policy": "content-addressed-external",
  "notes": [
    "eBible.org identifies ENGYLT / engylt as Young's Literal Translation, archaic British English, translated by Robert Young, and Public Domain.",
    "The official eBible developer format listing exposes engylt_usfm.zip as the USFM source archive.",
    "The official eBible Scripts directory listed engylt_usfm.zip at 1,385,550 bytes with timestamp 2026-06-11 13:23:20 at registration time.",
    "The source/copyright HTML states that generated files dated 2026-06-11 were produced from source files dated 2025-12-12.",
    "The SHA-256 is intentionally unpinned until a bounded controlled acquisition observation succeeds.",
    "The corpus ZIP must not be committed to Git history."
  ]
}
